{
  "$schema": "https://json-schema.org/draft/2020-12/schema",
  "title": "AutoPipeline System Policy",
  "type": "object",
  "additionalProperties": false,
  "required": [
    "schema_version",
    "system_id",
    "execution_policy",
    "continuity_policy",
    "canonical_stages",
    "program_responsibilities",
    "chatgpt_responsibilities",
    "quality_policy"
  ],
  "properties": {
    "schema_version": {
      "const": "1.0"
    },
    "system_id": {
      "type": "string",
      "minLength": 1
    },
    "execution_policy": {
      "type": "object",
      "additionalProperties": false,
      "required": [
        "ai_mode",
        "additional_paid_ai_budget_krw",
        "allow_paid_fallback",
        "on_subscription_limit",
        "user_trigger_required",
        "unattended_subscription_invocation",
        "asset_production_requires_authorized_packet",
        "asset_production_requires_bound_media_evidence",
        "asset_production_requires_visual_contract",
        "pending_authority_change_blocks_dependent_execution",
        "authority_commit_and_verify_before_dependent_dispatch",
        "asset_production_requires_dispatch_receipt",
        "media_integrity_required_before_reference_binding",
        "media_integrity_required_before_approval_or_composition",
        "recorded_hash_alone_is_not_media_validation"
      ],
      "properties": {
        "ai_mode": {
          "const": "CHATGPT_SUBSCRIPTION_FIRST"
        },
        "additional_paid_ai_budget_krw": {
          "const": 0
        },
        "allow_paid_fallback": {
          "const": false
        },
        "on_subscription_limit": {
          "const": "SUSPEND_AND_RESUME"
        },
        "user_trigger_required": {
          "const": true
        },
        "unattended_subscription_invocation": {
          "const": false
        },
        "asset_production_requires_authorized_packet": {
          "const": true
        },
        "asset_production_requires_bound_media_evidence": {
          "const": true
        },
        "asset_production_requires_visual_contract": {
          "const": true
        },
        "pending_authority_change_blocks_dependent_execution": {
          "const": true
        },
        "authority_commit_and_verify_before_dependent_dispatch": {
          "const": true
        },
        "asset_production_requires_dispatch_receipt": {
          "const": true
        },
        "media_integrity_required_before_reference_binding": {
          "const": true
        },
        "media_integrity_required_before_approval_or_composition": {
          "const": true
        },
        "recorded_hash_alone_is_not_media_validation": {
          "const": true
        }
      }
    },
    "continuity_policy": {
      "type": "object",
      "additionalProperties": false,
      "required": [
        "context_contamination_action",
        "contamination_signals",
        "handoff_required_fields",
        "unsafe_context_is_sticky",
        "post_threshold_outputs_quarantined",
        "ambient_conversation_context_is_not_contamination",
        "renderer_dispatch_capsule_isolation",
        "same_session_allowed_when_dispatch_and_output_qc_pass",
        "new_session_requires_contamination_evidence_or_identity_uncertainty"
      ],
      "properties": {
        "context_contamination_action": {
          "const": "HANDOFF_TO_NEW_SESSION"
        },
        "contamination_signals": {
          "type": "array",
          "items": {
            "type": "string",
            "minLength": 1
          },
          "minItems": 1,
          "uniqueItems": true
        },
        "handoff_required_fields": {
          "type": "array",
          "items": {
            "type": "string",
            "minLength": 1
          },
          "minItems": 1,
          "uniqueItems": true
        },
        "unsafe_context_is_sticky": {
          "const": true
        },
        "post_threshold_outputs_quarantined": {
          "const": true
        },
        "ambient_conversation_context_is_not_contamination": {
          "const": true
        },
        "renderer_dispatch_capsule_isolation": {
          "const": "TARGET_ONLY_AT_CALL_BOUNDARY"
        },
        "same_session_allowed_when_dispatch_and_output_qc_pass": {
          "const": true
        },
        "new_session_requires_contamination_evidence_or_identity_uncertainty": {
          "const": true
        }
      }
    },
    "canonical_stages": {
      "type": "array",
      "minItems": 1,
      "items": {
        "type": "object",
        "additionalProperties": false,
        "required": [
          "id",
          "order",
          "owner"
        ],
        "properties": {
          "id": {
            "type": "string",
            "pattern": "^[A-Z][A-Z0-9_]+$"
          },
          "order": {
            "type": "integer",
            "minimum": 1
          },
          "owner": {
            "enum": [
              "CHATGPT_ASSISTED",
              "PROGRAM",
              "HYBRID"
            ]
          }
        }
      }
    },
    "program_responsibilities": {
      "type": "array",
      "items": {
        "type": "string",
        "minLength": 1
      },
      "minItems": 1,
      "uniqueItems": true
    },
    "chatgpt_responsibilities": {
      "type": "array",
      "items": {
        "type": "string",
        "minLength": 1
      },
      "minItems": 1,
      "uniqueItems": true
    },
    "quality_policy": {
      "type": "object",
      "additionalProperties": false,
      "required": [
        "hard_contract_qc_precedes_subjective_qc",
        "sequence_qc_before_final_art_gate",
        "fixed_direction_quotas_forbidden",
        "viewer_perceived_redundancy_review",
        "declared_semantic_intent_qc",
        "high_risk_interaction_geometry_qc",
        "rejected_output_quarantine",
        "minimal_repair_scope",
        "media_integrity_precedes_subjective_qc"
      ],
      "properties": {
        "hard_contract_qc_precedes_subjective_qc": {
          "const": true
        },
        "sequence_qc_before_final_art_gate": {
          "const": true
        },
        "fixed_direction_quotas_forbidden": {
          "const": true
        },
        "viewer_perceived_redundancy_review": {
          "const": true
        },
        "declared_semantic_intent_qc": {
          "const": true
        },
        "high_risk_interaction_geometry_qc": {
          "const": true
        },
        "rejected_output_quarantine": {
          "const": true
        },
        "minimal_repair_scope": {
          "const": true
        },
        "media_integrity_precedes_subjective_qc": {
          "const": true
        }
      }
    }
  }
}
