{
  "schema_version": "1.0",
  "system_id": "autopipeline-toon-production",
  "execution_policy": {
    "ai_mode": "CHATGPT_SUBSCRIPTION_FIRST",
    "additional_paid_ai_budget_krw": 0,
    "allow_paid_fallback": false,
    "on_subscription_limit": "SUSPEND_AND_RESUME",
    "user_trigger_required": true,
    "unattended_subscription_invocation": false,
    "asset_production_requires_authorized_packet": true,
    "asset_production_requires_bound_media_evidence": true,
    "asset_production_requires_visual_contract": true,
    "pending_authority_change_blocks_dependent_execution": true,
    "authority_commit_and_verify_before_dependent_dispatch": true,
    "asset_production_requires_dispatch_receipt": true,
    "media_integrity_required_before_reference_binding": true,
    "media_integrity_required_before_approval_or_composition": true,
    "recorded_hash_alone_is_not_media_validation": true
  },
  "continuity_policy": {
    "context_contamination_action": "HANDOFF_TO_NEW_SESSION",
    "contamination_signals": [
      "confirmed rule is repeatedly missed",
      "retired decision reappears as active",
      "conversation claims conflict with repository authority",
      "same correction repeats without a new diagnosis",
      "current artifact identity or approval scope becomes uncertain",
      "same hard output contract fails twice in one conversational render context",
      "observed future-shot or multi-shot leakage in renderer dispatch or output"
    ],
    "handoff_required_fields": [
      "verified_repository_heads",
      "current_system_stage",
      "completed_work",
      "active_decisions",
      "approved_artifacts",
      "open_blockers",
      "next_single_action",
      "quarantined_outputs"
    ],
    "unsafe_context_is_sticky": true,
    "post_threshold_outputs_quarantined": true,
    "ambient_conversation_context_is_not_contamination": true,
    "renderer_dispatch_capsule_isolation": "TARGET_ONLY_AT_CALL_BOUNDARY",
    "same_session_allowed_when_dispatch_and_output_qc_pass": true,
    "new_session_requires_contamination_evidence_or_identity_uncertainty": true
  },
  "canonical_stages": [
    {
      "id": "WORK_RESEARCH",
      "order": 1,
      "owner": "CHATGPT_ASSISTED"
    },
    {
      "id": "RADAR",
      "order": 2,
      "owner": "CHATGPT_ASSISTED"
    },
    {
      "id": "EDITORIAL",
      "order": 3,
      "owner": "CHATGPT_ASSISTED"
    },
    {
      "id": "STORYBOARD",
      "order": 4,
      "owner": "CHATGPT_ASSISTED"
    },
    {
      "id": "ASSET_PRODUCTION",
      "order": 5,
      "owner": "HYBRID"
    },
    {
      "id": "COMPOSITION",
      "order": 6,
      "owner": "PROGRAM"
    },
    {
      "id": "QC",
      "order": 7,
      "owner": "HYBRID"
    },
    {
      "id": "EXPORT",
      "order": 8,
      "owner": "PROGRAM"
    },
    {
      "id": "RETROSPECTIVE",
      "order": 9,
      "owner": "HYBRID"
    }
  ],
  "program_responsibilities": [
    "persistent_project_state",
    "asset_identity_and_hashes",
    "approval_version_binding",
    "editable_text_ui_and_layout",
    "deterministic_composition",
    "targeted_invalidation",
    "resume_from_saved_artifact",
    "export",
    "media_integrity_validation"
  ],
  "chatgpt_responsibilities": [
    "source_research",
    "editorial_reasoning",
    "story_and_storyboard_drafting",
    "image_generation_when_available",
    "visual_review_when_actual_media_is_available"
  ],
  "quality_policy": {
    "hard_contract_qc_precedes_subjective_qc": true,
    "fixed_direction_quotas_forbidden": true,
    "viewer_perceived_redundancy_review": true,
    "declared_semantic_intent_qc": true,
    "high_risk_interaction_geometry_qc": true,
    "rejected_output_quarantine": true,
    "minimal_repair_scope": true,
    "sequence_qc_before_final_art_gate": true,
    "media_integrity_precedes_subjective_qc": true
  }
}
